{
  "aoi": {
    "bbox_policy": "tile_to_source_limits",
    "input_crs": "EPSG:4326",
    "path": "tests/fixtures/ohio_cdl_edges/inputs/aoi.geojson"
  },
  "outputs": {
    "manifest_dir": "manifests",
    "plan_dir": "plans",
    "raster_format": "COG"
  },
  "project": {
    "created": "2026-07-06",
    "id": "golden_nlcd_aws_tile"
  },
  "sources": [
    {
      "acquisition_mode": "https_template",
      "id": "nlcd_tile",
      "registry_key": "annual_nlcd_aws_tile",
      "resampling": "bilinear",
      "semantic_type": "continuous",
      "thematic_layers": [
        "fractional_impervious"
      ],
      "years": [
        1985
      ]
    }
  ],
  "target_grid": {
    "crs": "EPSG:5070",
    "nodata": 255,
    "resolution_m": 30,
    "snap": "aoi_bounds"
  }
}
